{
  "core": {
    "name": "proof-core",
    "version": "0.1.0",
    "digest": "sha256:1111111111111111111111111111111111111111111111111111111111111111"
  },
  "validator": {
    "name": "openapi-spec-validator",
    "version": "0.9.0",
    "digest": "sha256:2222222222222222222222222222222222222222222222222222222222222222"
  },
  "rulePack": {
    "name": "agent-contract",
    "version": "0.1.0",
    "digest": "sha256:3333333333333333333333333333333333333333333333333333333333333333"
  },
  "runtime": {
    "name": "cpython",
    "version": "3.14.6",
    "digest": "sha256:4444444444444444444444444444444444444444444444444444444444444444"
  },
  "configuration": {
    "digest": "sha256:5555555555555555555555555555555555555555555555555555555555555555"
  },
  "input": {
    "digest": "sha256:6666666666666666666666666666666666666666666666666666666666666666"
  }
}
